{
  "$schema": "https://ai-trading-firm.local/schemas/help-3-ebenen.json",
  "id": "ops",
  "version": 1,
  "title": "Operations Center & RBAC — Feldhilfe",
  "description": "Hilfetexte zu Rollen, Permissions, Live-Sperre und dem leeren Operations-Center-Tab (Task 10, Phase 1) im 3-Ebenen-Schema.",
  "source": "src/auth/",
  "fields": {
    "role.viewer": {
      "kurzinfo": "Viewer darf den Status lesen, nichts schreiben.",
      "technischeInfo": "Permissions: firm.read, ops.view, broker.status, routing.read. Token: FIRM_VIEWER_TOKEN → x-viewer-token.",
      "risiko": "Ein Viewer mit Schreibzugriff wäre ein RBAC-Bruch — GET-Routen bleiben bewusst tokenfrei, Mutationen nicht."
    },
    "role.operator": {
      "kurzinfo": "Operator darf Pipeline, Kill-Switch und Config, aber keine Broker-Secrets.",
      "technischeInfo": "Zusätzlich firm.write/kill/config und broker.test. Token: FIRM_API_TOKEN. Ohne FIRM_ADMIN_TOKEN erbt der Operator Admin-Rechte (Single-Admin).",
      "risiko": "Elevation ist Absicht für den Solo-Betrieb. Sobald ein Admin-Token existiert, verliert der Operator broker.credentials und routing.modes.write."
    },
    "role.admin": {
      "kurzinfo": "Admin verwaltet Credentials und Routing-Modi.",
      "technischeInfo": "Alle Operator-Rechte plus broker.credentials und routing.modes.write. Token: FIRM_ADMIN_TOKEN. Local-open (kein Token) gilt als Admin.",
      "risiko": "Admin ist nicht Live-Freigabe. live.gate bleibt leer bis Task 11."
    },
    "live.gate": {
      "kurzinfo": "Permission für Live-Gate-Transitionen und Kill (Task 11): Admin-Rolle, CSRF-Pflicht, 5 Anfragen/min/IP.",
      "technischeInfo": "POST /api/live/transition und POST /api/live/kill verlangen live.gate (heute Admin-Token FIRM_ADMIN_TOKEN) plus x-csrf-token (CSRF_INVALID bei Fehlen) plus Kill-Phrase ('KILL' bzw. 'CLEAR_KILL'). GET /api/live/state ist read-only und frei lesbar. Rate-Limit wie Credentials: 5/min/IP (429 GATE_RATE_LIMITED). Jede Aktion landet in der Audit-Hash-Kette.",
      "risiko": "Der Status live ist rein informativ und immer fail-closed, bis die Live-State-Machine vollstaendig durchlaufen ist. Ihn als Freigabe zu deuten, ist ein Missverstaendnis."
    },
    "ops.modules": {
      "kurzinfo": "Karten im Operations Center: bereit, Phase 3 oder gesperrt.",
      "technischeInfo": "GET /api/ops liefert die Hülle ohne Widget-Daten. Tab brokers ist 'ready' und verlinkt den bestehenden Control-Plane-Tab.",
      "risiko": "Die Hülle aggregiert keine Secrets. Phase-3-Kacheln bleiben read-only GETs."
    }
  }
}
